{
  "$schema": "./readiness-schema-v1.json",
  "schemaVersion": 1,
  "candidateId": "UNASSIGNED",
  "status": "blocked",
  "network": "robinhood-testnet",
  "chainId": 46630,
  "deploymentManifest": "./robinhood-testnet.json",
  "gates": {
    "canonicalToken": {
      "status": "PASS",
      "evidence": [
        "https://docs.paxos.com/guides/stablecoin/usdg/testnet",
        "../../docs/release/testnet-usdg-evidence.md"
      ],
      "owner": "Backed By Fans implementation review",
      "reviewedAtUtc": "2026-08-26T13:56:57Z"
    },
    "publicPilot": {
      "status": "BLOCKED",
      "evidence": [],
      "blocker": "No verified public deployment exists and the unassisted pilot has not run."
    },
    "brandClearance": {
      "status": "BLOCKED",
      "evidence": [],
      "blocker": "Professional naming and launch asset clearance are incomplete."
    },
    "artifactFreeze": {
      "status": "OPEN",
      "evidence": [],
      "blocker": "The release candidate cannot be frozen before pilot and review findings are resolved."
    },
    "accountingReview": {
      "status": "BLOCKED",
      "evidence": [],
      "blocker": "No independent accounting review has been commissioned or completed."
    },
    "securityAudit": {
      "status": "BLOCKED",
      "evidence": [],
      "blocker": "No independent security audit has been commissioned or completed."
    },
    "reproducibleBuild": {
      "status": "OPEN",
      "evidence": [],
      "blocker": "Independent reproduction requires a signed frozen artifact."
    },
    "safeReadiness": {
      "status": "BLOCKED",
      "evidence": [],
      "blocker": "Production Safe identities, thresholds, modules, guards, fallbacks, and rehearsals are unresolved."
    },
    "deploymentVerification": {
      "status": "BLOCKED",
      "evidence": [],
      "blocker": "No public testnet deployment manifest or second-RPC verification exists."
    },
    "monitoringReadiness": {
      "status": "OPEN",
      "evidence": [],
      "blocker": "Production providers, responders, alerts, and observation records are not configured."
    },
    "humanAuthorization": {
      "status": "BLOCKED",
      "evidence": [],
      "blocker": "Mainnet deployment has not been explicitly authorized."
    }
  },
  "signatures": []
}
